,电影名称,信息,评分,评价人数,短评
244,再次出发之纽约遇见你,导演: 约翰·卡尼 John Carney 主演: 凯拉·奈特莉 Keira Knightley / 马克... 2013 / 美国 / 喜剧 爱情 音乐,8.6,421487人评价,爱我就给我看你的播放列表。
245,哈利·波特与凤凰社,导演: 大卫·叶茨 David Yates 主演: 丹尼尔·雷德克里夫 Daniel Radcliffe... 2007 / 英国 美国 / 奇幻 冒险,8.5,554026人评价,
246,白日梦想家,导演: 本·斯蒂勒 Ben Stiller 主演: 本·斯蒂勒 Ben Stiller / 克里斯汀·... 2013 / 美国 英国 / 剧情 喜剧 冒险,8.6,458853人评价,
247,香水,导演: 汤姆·提克威 Tom Tykwer 主演: 本·卫肖 Ben Whishaw / 艾伦·瑞克... 2006 / 德国 法国 西班牙 美国 比利时 / 剧情 犯罪 奇幻,8.5,537684人评价,一个单凭体香达到高潮的男人。
248,海洋,导演: 雅克·贝汉 Jacques Perrin / 雅克·克鲁奥德 Jacques Cluzaud 主演:... 2009 / 法国 瑞士 西班牙 美国 阿联酋 摩纳哥 / 纪录片,9.1,155281人评价,大海啊，不全是水。
249,穿越时空的少女,导演: 细田守 Mamoru Hosoda 主演: 仲里依纱 Riisa Naka / 石田卓也 Takuya... 2006 / 日本 / 剧情 爱情 科幻 动画,8.6,377028人评价,爱上未来的你。
